{
  "encoding": {
    "keyframeInterval": 50,
    "mode": "delta"
  },
  "id": "trc_0",
  "language": {
    "adapter": "cpp-gdb/0.3.0",
    "id": "cpp17-gcc",
    "runtime": "GCC 13.5.0"
  },
  "options": {
    "maxSteps": 1000,
    "startAtLines": []
  },
  "source": {
    "file": "main.py",
    "lineCount": 20
  },
  "steps": [
    {
      "callId": 0,
      "error": null,
      "event": "line",
      "frames": {
        "f0": {
          "id": "f0",
          "kind": "global",
          "line": 5,
          "locals": [
            {
              "name": "a",
              "value": {
                "id": "o1",
                "t": "ref",
                "type": "int [200]"
              }
            },
            {
              "name": "big",
              "value": {
                "id": "o2",
                "t": "ref",
                "type": "long long [1000000]"
              }
            }
          ],
          "name": "Globals",
          "returnValue": null
        },
        "f1": {
          "id": "f1",
          "kind": "function",
          "line": 5,
          "locals": [],
          "name": "main",
          "returnValue": null
        }
      },
      "heap": {
        "o1": {
          "fixed": true,
          "kind": "sequence",
          "length": 200,
          "sparse": {
            "default": {
              "t": "int",
              "v": "0"
            },
            "items": {}
          },
          "type": "int [200]"
        },
        "o2": {
          "fixed": true,
          "kind": "sequence",
          "length": 1000000,
          "sparse": {
            "default": {
              "t": "int",
              "v": "0"
            },
            "items": {
              "3": {
                "t": "int",
                "v": "7"
              }
            }
          },
          "truncated": true,
          "type": "long long [1000000]",
          "window": {
            "count": 1000,
            "start": 0
          }
        }
      },
      "i": 0,
      "keyframe": true,
      "line": 5,
      "prevLine": 4,
      "removedObjects": [],
      "stack": [
        "f0",
        "f1"
      ],
      "stderr": "",
      "stdout": ""
    },
    {
      "error": null,
      "event": "line",
      "frames": {
        "f0": {
          "id": "f0",
          "kind": "global",
          "line": 6,
          "locals": [
            {
              "name": "a",
              "value": {
                "id": "o1",
                "t": "ref",
                "type": "int [200]"
              }
            },
            {
              "name": "big",
              "value": {
                "id": "o2",
                "t": "ref",
                "type": "long long [1000000]"
              }
            }
          ],
          "name": "Globals",
          "returnValue": null
        },
        "f1": {
          "id": "f1",
          "kind": "function",
          "line": 6,
          "locals": [],
          "name": "main",
          "returnValue": null
        }
      },
      "heap": {
        "o1": {
          "kind": "sequence",
          "length": 200,
          "patch": {
            "2": {
              "t": "int",
              "v": "1"
            }
          },
          "type": "int [200]"
        }
      },
      "i": 1,
      "keyframe": false,
      "line": 6,
      "prevLine": 5,
      "removedObjects": [],
      "stack": [
        "f0",
        "f1"
      ],
      "stderr": "",
      "stdout": ""
    },
    {
      "error": null,
      "event": "line",
      "frames": {
        "f0": {
          "id": "f0",
          "kind": "global",
          "line": 7,
          "locals": [
            {
              "name": "a",
              "value": {
                "id": "o1",
                "t": "ref",
                "type": "int [200]"
              }
            },
            {
              "name": "big",
              "value": {
                "id": "o2",
                "t": "ref",
                "type": "long long [1000000]"
              }
            }
          ],
          "name": "Globals",
          "returnValue": null
        },
        "f1": {
          "id": "f1",
          "kind": "function",
          "line": 7,
          "locals": [],
          "name": "main",
          "returnValue": null
        }
      },
      "heap": {
        "o2": {
          "kind": "sequence",
          "length": 1000000,
          "patch": {
            "4": {
              "t": "int",
              "v": "9"
            }
          },
          "type": "long long [1000000]"
        }
      },
      "i": 2,
      "keyframe": false,
      "line": 7,
      "prevLine": 6,
      "removedObjects": [],
      "stack": [
        "f0",
        "f1"
      ],
      "stderr": "",
      "stdout": ""
    },
    {
      "error": null,
      "event": "line",
      "frames": {
        "f0": {
          "id": "f0",
          "kind": "global",
          "line": 8,
          "locals": [
            {
              "name": "a",
              "value": {
                "id": "o1",
                "t": "ref",
                "type": "int [200]"
              }
            },
            {
              "name": "big",
              "value": {
                "id": "o2",
                "t": "ref",
                "type": "long long [1000000]"
              }
            }
          ],
          "name": "Globals",
          "returnValue": null
        },
        "f1": {
          "id": "f1",
          "kind": "function",
          "line": 8,
          "locals": [],
          "name": "main",
          "returnValue": null
        }
      },
      "heap": {
        "o1": {
          "kind": "sequence",
          "length": 200,
          "patch": {
            "2": {
              "t": "int",
              "v": "0"
            }
          },
          "type": "int [200]"
        }
      },
      "i": 3,
      "keyframe": false,
      "line": 8,
      "prevLine": 7,
      "removedObjects": [],
      "stack": [
        "f0",
        "f1"
      ],
      "stderr": "",
      "stdout": ""
    },
    {
      "error": null,
      "event": "line",
      "frames": {
        "f0": {
          "id": "f0",
          "kind": "global",
          "line": 9,
          "locals": [
            {
              "name": "a",
              "value": {
                "id": "o1",
                "t": "ref",
                "type": "int [200]"
              }
            },
            {
              "name": "big",
              "value": {
                "id": "o2",
                "t": "ref",
                "type": "long long [1000000]"
              }
            }
          ],
          "name": "Globals",
          "returnValue": null
        },
        "f1": {
          "id": "f1",
          "kind": "function",
          "line": 9,
          "locals": [],
          "name": "main",
          "returnValue": null
        }
      },
      "heap": {
        "o1": {
          "fixed": true,
          "kind": "sequence",
          "length": 200,
          "sparse": {
            "default": {
              "t": "int",
              "v": "1061109567"
            },
            "items": {}
          },
          "type": "int [200]"
        }
      },
      "i": 4,
      "keyframe": false,
      "line": 9,
      "prevLine": 8,
      "removedObjects": [],
      "stack": [
        "f0",
        "f1"
      ],
      "stderr": "",
      "stdout": ""
    },
    {
      "error": null,
      "event": "line",
      "frames": {
        "f0": {
          "id": "f0",
          "kind": "global",
          "line": 10,
          "locals": [
            {
              "name": "a",
              "value": {
                "id": "o1",
                "t": "ref",
                "type": "int [200]"
              }
            },
            {
              "name": "big",
              "value": {
                "id": "o2",
                "t": "ref",
                "type": "long long [1000000]"
              }
            }
          ],
          "name": "Globals",
          "returnValue": null
        },
        "f1": {
          "id": "f1",
          "kind": "function",
          "line": 10,
          "locals": [],
          "name": "main",
          "returnValue": null
        }
      },
      "heap": {
        "o1": {
          "kind": "sequence",
          "length": 200,
          "patch": {
            "199": {
              "t": "int",
              "v": "5"
            }
          },
          "type": "int [200]"
        },
        "o2": {
          "kind": "sequence",
          "length": 1000000,
          "patch": {
            "3": {
              "t": "int",
              "v": "0"
            }
          },
          "type": "long long [1000000]"
        }
      },
      "i": 5,
      "keyframe": false,
      "line": 10,
      "prevLine": 9,
      "removedObjects": [],
      "stack": [
        "f0",
        "f1"
      ],
      "stderr": "",
      "stdout": ""
    }
  ],
  "summary": {
    "exit": {
      "code": 0,
      "kind": "normal",
      "message": null,
      "signal": null
    },
    "lineHits": {
      "10": 1,
      "5": 1,
      "6": 1,
      "7": 1,
      "8": 1,
      "9": 1
    },
    "lineHitsSource": "trace",
    "stepCount": 6,
    "truncated": false,
    "truncation": null
  },
  "version": "1.2"
}
